video_Id,comment,label,,
2BmUVchDqCk,"Bonjour moi j’ai la série 4 et franchement Apple doit arrêter de produire des nouvelles montre, chaque années, il devrait plutôt se pencher sur le software hardware pour rendre cette montre plus intéressante, car les nouveautés ne sont pas indispensables que ce soit pour les professionnels ou les sportifs rien de emballant! Une perte de temps pour le grand public. Un client Apple va garder sa montre en moyenne 4 ans! J’ai l’impression que les ingénieurs se font chier à trouver des astuces pour améliorer, expérience utilisateur.",1,,
2BmUVchDqCk,"""Merci à notre sponsor de nous permettre de faire cette vidéo en toute indépendance"". Je me suis étranglé quand j'ai entendu ça",0,,
2BmUVchDqCk,"Personne ne se demande ce que Marc Newsonn à la base, voulait concrétiser ? Perso je pense que la série 7 en est l’aboutissement en terme de Design, et pour une fois la watch ressemble bien à une montre et pas à un objet geek. Les 20% d’écran et les bords arrondis du dessus change  la donne.",1,,
2BmUVchDqCk,"Pour ""surveiller"" ton sommeil, tu te prends un Withings Sleep Analyzer"" et tu as tout même l'enregistrement de tes ronflements !  ",1,,
2BmUVchDqCk,Vous êtes top les mecs.. Grâce à vous je ne change pas mon AW4 pour une AW7 (j'attendais le nouveau square design pour changer)  mais pour une Tag Connected. Merci ! :-),1,,
2BmUVchDqCk,pourquoi la taille de l'é'cran devrait elle etre plus grande à chaque version? tout le monde n'est pas à la recherche de la montre la plus encombrante possible,1,,
2BmUVchDqCk,Bien que cela n’as pas rapport direct avec la série 7 …une petite nouveauté…maintenant je peux payer l’autoroute ( Vinci) avec ma montre,1,,
2BmUVchDqCk,"bah apple c est la pomme et vous , vous êtes les poires",0,,
2BmUVchDqCk,Moi je passe de la série 2 à la série 7,0,,
2BmUVchDqCk,Top la vignette !!!!!,0,,
2BmUVchDqCk,Y’a rien de plus que la série 6 . La 7 est une arnaque. C’est comme l’iPhone 13 par rapport au 12,0,,
2BmUVchDqCk,Pour l'instant CarPlay wifi est pas répandu donc le port on l'aura encore un moment,1,,
2BmUVchDqCk,"cool cette vidéo, je connais pas grand chose question Apple Watch, je m'y connais beaucoup plus pour les autres produits Apple, notamment ceux qui fonctionnent sur iOS comme les iPhone, iPad, et iPod Touch.
Je voulais un petit coup de pouce pour savoir quelle Apple Watch acheter, car je n'en ai jamais eu.
Et sérieusement je pense que je vais acheter la série SE, et les mises à jour ça existe aussi, non ?
Mais c'est vrai qu'acheter la série 7 n'aurait pas beaucoup d'intérêt !",1,,
2BmUVchDqCk,J'ai l'Apple Watch série 5 et elle me suffit.,0,,
2BmUVchDqCk,"Ben voilà, c’est réglé, y’en a plus.",0,,
2BmUVchDqCk,Voilà pourquoi je n achèterai pas d apple watch   j en ai pas encore mais je pense attendre soit la 8 soit genre au moins 5 ans pour avoir quelque chose de mieux,1,,
2BmUVchDqCk,"5:55 ""Jmen fou "" il étais violent mdr",0,,
2BmUVchDqCk,"Hello, tu parles dans ta vidéo de la Galaxy watch (4) mais elle n’est pas compatible avec un iPhone? Je préférais l’affichage de la Galaxy watch 4 qui est vraiment stylé mais déçu de voir que ce n’était pas compatible je me suis « rabattu » sur l’Apple Watch (pour le moment rien acheté)... ton avis là dessus ?! @Nowtech",1,,
2BmUVchDqCk,"Si peu de nouveauté depuis tant de temps, j’ai pris une garmin en attendant un grand changement",1,,
2BmUVchDqCk,Super vidéo NowTech,0,,
2BmUVchDqCk,Does the watch scratch quickly? Should I protect it ?,0,,
2BmUVchDqCk,quand papi fait des videos,0,,
2BmUVchDqCk,"Le green washing par Apple qui clame son ""soucis de l'environnement"" en faisant l'impasse d'un chargeur, qui enlève le blister des AW, tout en mettant 2 bracelets sport en plastique dans la boite, dont un est voué à la poubelle. Merveilleux. Mieux encore, le quizz du remplacement de la batterie AW.  Et oui, parce qu'à peine achetée, cette ""montre"" est condamnée à l'obsolescence d'ici 3, 4 ans... 387 € en atelier Apple !! Pas grave, on achètera une nouvelle montre et on remplira nos tiroirs avec les anciennes.
Super green, Apple.",1,,
2BmUVchDqCk,"Merci pour cette présentation. Vous êtes mon Essayeur préféré des produits Apple. Pour cette montre, Je viens de la recevoir. L’écran de 41 mm propose un affichage que je ressens vraiment plus grand que celui de mon Apple Watch SE de 40 mm. Pour moi, la différence n’est pas du tout qu’à peine visible. La finesse de la tranche de la montre y gagne aussi, avec l’écran bombé qui affine les bords. L’affichage permanent me plait aussi beaucoup. Ses principaux défauts sont son prix, et sa disponibilité actuelle (j’ai dû l’attendre plus de 3 semaines).",1,,
2BmUVchDqCk,Elle est où la Samsung watch 4 classic ?,0,,
2BmUVchDqCk,N’ayant pas de appel Watch et pour une 1ère j’opterais plutôt à la série 7 45mm. J’espère vivre une belle expérience car j’étais super satisfait de ma Samsung gear Watch,0,,
2BmUVchDqCk,J’aime beaucoup tes vidéos. Je te trouve vrai.,0,,
2BmUVchDqCk,"Qui dit nouveautés dit nouveaux capteurs et donc autonomie en baisse or là, on est déjà limite...  Ce sont les fonctions ""médicales"" qui m'intéressent, je suis donc passé de l'Apple watch 5 à la scanwatch de Withings sans regret.",1,,
2BmUVchDqCk,J’ai encore une série 2 il serait peut-être temps de changer   Maintenant vu le peu de différence série 6 et 7 j’hésite entre les 2 !,1,,
2BmUVchDqCk,"Merci Jérome pour cette excellente critique. Je ne suis pas encore un adepte de ce produit mais cela pourrait peut être m'intéresser dans quelques années lorsque l'autonomie sera un peu plus grande. En déplacement, faut-il toujours avoir son iPhone à proximité pour que la montre soit pleinement fonctionnelle ?",1,,
2BmUVchDqCk,Ils sont gonflés chez Nowtech. Une perte de temps l’Apple Watch ? Ils ont fait leur beurre avec une bonne douzaine de vidéos sur l’Apple Watch et ils font du click bait « une perte de temps » ?? A pleurer de rire. Je sais c’est pas facile de survivre pour une chaîne streaming high tec mais là vous forcez les mecs.,1,,
2BmUVchDqCk,Top merci,0,,
2BmUVchDqCk,sans hésiter Samsung en même temps mon tél est un note,0,,
2BmUVchDqCk,"Merci pour la vidéo, petite question, plutôt acheter la 7 ou SE ? Bis",1,,
2BmUVchDqCk,Y’a même plus le gris sidéral qui est la plus belle couleur,0,,
2BmUVchDqCk,Toujours au top t’es vidéo merci,0,,
2BmUVchDqCk,"Bonjour, merci pour cette vidéo et merci également pour rhinoshield, me concernant ce sera ma toute première Apple Watch donc je pense être du coup satisfaite, dommage que vous ne parliez pas de la fonction cellular. Je m’en vais donc de ce pas chercher un peu plus d’info. Bonne continuation. Je m’abonne.",1,,
2BmUVchDqCk,Passant d’une série 5 à la série 7 je trouve justement que l’écran plus grand fait toute la différence !,1,,
2BmUVchDqCk,Tu exagères beaucoup! Je vais quand même l’acheter,0,,
2BmUVchDqCk,"Très bonnes vidéo :)
Et malheureusement si j ai bien peur qu Apple prends du retard, et ça maintenant depuis 3-4 ans … toute cette génération est a laissé de côté .",1,,
2BmUVchDqCk,Salut peux tu tester les air pod pro sans embouts silicones et comparer avec les air pod «3?,1,,
2BmUVchDqCk,"J'aimerai revenir sur les batteries d'apple watch et l'autonomie en general, dans beaucoup de montre que j'ai testé (enfin pas énorme mais ça m'a suffit pour un peu déduire), c'est que souvent les montres ont toujours un compromis, si vous avez de l'autonomie, vous avez surement pas d'écran ou un écran très pauvre en qualité. 
Si vous avez une grosse batterie et un belle écran, vous avez une grosse montre (je suis désolé mais la gamme samsung gear elles sont énormes et peu confortable). 

Aussi, sans parler vraiment de batterie mais en parlant de compromis, je trouve que l'apple watch a peu de compromis outre la batterie, car elles est très polyvalente, elle est très bien synchroniser avec le telephone (je suis désolé mais les samsung gear et fitbit, c'est ... on dirai que l'on a deux systèmes séparés qui parfois se synchronise un peu ...) 
et souvent les autres montres sont pas très belles (on en parles du système de tap pour fitbit, ou le gros cercle qui bouge sur les samsung watch .....)",1,,
2BmUVchDqCk,Joli gadget!,0,,
2BmUVchDqCk,Mois je l’attend j’ai une série 5 j’aurais quand même des nouveautés,0,,
2BmUVchDqCk,Vidéo très pro ! Un plaisir à regarder. As usual,0,,
2BmUVchDqCk,"Je l’ai acheté car c’est la taille de l’écran qui avait freiné mon achat de la S6 ( j’ai un petit poignet et la 1ère taille d’écran était trop petite alors que sur celle là c’est ok ).

Ensuite c’est ma 1ère Apple Watch et les fonctionnalités qu’il y a côté santé me suffisent ( la glycémie en + -> je ne suis pas concernée, la température -> ok,  mais pas essentiel ).

Du coup j’en suis déjà très contente ( et très loin d’en connaître toutes les fonctionnalités ).
J’ai switché sur iOS il y a 2 ans donc mon équipement est de l’Apple ( MBP, iPad, iPhone, Apple TV, AirPods ) et là, elle a encore plus de sens.

Cependant je suis d’accord avec ton avis, c’est un coup quasi dans l’eau.",1,,
2BmUVchDqCk,Moi je vous aime les YouTube. Que vous fassiez des vidéos pour présenter Ok. Mais que vous dites n’achetez pas ou quoi que ce soit on fait quand même ce que l’on veux de notre pognon,0,,
2BmUVchDqCk,Et donc toi t’as fais des cascades sans les protections rhinoshield???,0,,
MrN4yI2K-5g,Alors vous êtes plutôt batterie   Apple ou Anker   ?,0,,
MrN4yI2K-5g,J aime beaucoup tes tests et commentaires techniques avec tes pointes d humour…,0,,
MrN4yI2K-5g,bon jeux de mots,0,,
MrN4yI2K-5g,Savez-vous si la batterie ANKER est compatible avec un iPhone SE 2020 ?,1,,
MrN4yI2K-5g,"Merci pour ce superbe test ! Attention cependant, la batterie Anker n'étant pas certifiée officiellement ""Made for MagSafe"" , on ne peut rien garantir quant à la stabilité , la qualité, et l'impact sur la batterie de l'iPhone sur le long terme ...",1,,
MrN4yI2K-5g,", Concernant l’Apple, l’aimant est il assez fort pour tenir un iPhone équipé d’une housse silicone standard ? Merci",1,,
MrN4yI2K-5g,Pour information J’ai la batterie anker et recharge 60% de mon iPhone 13 pro max,1,,
MrN4yI2K-5g,"Salut Jérôme, je n'ai pas bien compris quelle est la valeur ajoutée du chargeur Satechi par rapport au chargeur original de l'Apple Watch ?",1,,
MrN4yI2K-5g,"Petite question, du coup elle n’est pas compatible si on a un 12 mini & une coque type « bumper » rhinoshield ?",1,,
MrN4yI2K-5g,Est-ce que l’un des produits permet de lutter contre l’usure de la batterie de l’iPhone ?,1,,
MrN4yI2K-5g,Plutôt Apple car plus design et beaucoup moins grossière,0,,
MrN4yI2K-5g,"Mauvais produit, elle ne charge pas pendant l’utilisation de certaine appli. A éviter jusqu’à amélioration.",1,,
MrN4yI2K-5g,"Bah oui les produit apple sont pas mieux que les autres mais sont bcp plus design. C’est pour ca qu’on paye plus cher. Ca jamais été pour avoir du meilleur matos qu’on paye plus cher chez apple. C’est tout une question de design ou d’environnement.

J’arrive pas a comprendre que des gens dit « professionnel » explique pas directement cela et arrête toute ses comparaisons précises.

Dans votre test on voit bien directement que on paye plus pour une histoire de design voir d’ergonomie car c’est certifié et pas compatible. Mais comme d’hab le produit apple est inférieur ou de meme qualité que les autres. 
Apple c’est juste plus beau et 99% des gens achète pour cela meme si 90% d’entre eux trouve d’autres excuse. Les débiles y’en a bcp. 

Bref Apple meilleur design        .",1,,
MrN4yI2K-5g,"Il y a d'autres batterie compatibles magsafe : LL Trader, Belkin....",0,,
MrN4yI2K-5g,"C'est sympa, j'aime beaucoup tes vidéos !",0,,
MrN4yI2K-5g,Suite à tes conseils je viens d’ajouter cette batterie mais est-il normal sur l’écran de l’iPhone de ne pas avoir l’animation recharge Mac safe sur l’iphone ??,1,,
MrN4yI2K-5g,"Pour moi de TOUS les testeurs de youtube tu fais partie du top 5. Une incroyable précision avec une clarté et simplicité de compréhension, bravo.",0,,
MrN4yI2K-5g,"Apple poussent clairement le magsafe pour le pognon...maintenant et a l'avenir: Apple finira donc même dans 4ans par supprimer tout port de charge pour éviter de tomber sous le coup de la directive européenne sur l'interopérabilité (pas de port, pas besoin d'avoir une prise usb-c).
Et vu le désastre écologique que ça va causer, il vont pas tarder à commencer le matraquage pour green washer cette technologie pour préparer le terrain.",1,,
MrN4yI2K-5g,"Anker c’est l’Apple des accessoires, ils sont vraiment bon et un très bon qualité/prix !",1,,
MrN4yI2K-5g,Ouais enfin 109 euros la batterie c’est chaud quoi non?,0,,
MrN4yI2K-5g,"J’ai un iphone, mais l’avidité financière d’apple me révolte, le prix, pas de cable de charge… même en ayant les moyens faut pas exagérer.",0,,
MrN4yI2K-5g,"Après cette vidéo et au vu de mes besoins, et de l’ensemble de mon matériel qui se charge en lithning  ( sauf mon M1 ) je viens de commander celle d’Apple.",0,,
MrN4yI2K-5g,La batterie anker est compatible avec l’iPhone 11 ? Sans que se soit magsafe,1,,
MrN4yI2K-5g,"vidéo très interressante mais au fond, au prix d'un iphone, quand vont ils réussir à faire un iphone qui dure plus d'une journée ? Ce que fait déjà Androïd depuis des années à moindre prix et ca semble logique/normale",1,,
MrN4yI2K-5g,"L'écriture est jolie, vraiment bien ficelé ta vidéo",0,,
MrN4yI2K-5g,Du moment où il-y-a la pomme j'ai l'impression que les prix s'affolent. Même si c'est une simple souris d'ordinateur du moment où-y-a le logo ça deviens un piège à pigeons.,0,,
MrN4yI2K-5g,Ils se sont pas vraiment fait « coiffé au poto » parce que chaque produit compatible MagSafe leur rapporte de la tune en vrai il s’en foute je pense !,0,,
MrN4yI2K-5g,je me suis abonné parce que tu cherche pas a faire de la pub a une grosse marque ^^,0,,
MrN4yI2K-5g,Merci pour tes vidéos !,0,,
MrN4yI2K-5g,2.56 haha,0,,
MrN4yI2K-5g,"perso, j'suis passé sur le samsung galaxy S10 5G , avec une batterie 4 fois plus grosse qu'un S10 normal (10A/h -50W/h), j'tiens facile 2 a 4 jours sans le rechargé ;-) , et en plus j'ai une prise jack d'origine, j'peut recharger les autres tel par induction, et j'ai pas de carte mémoire, mais 256Go de mémoire interne d'origine ;-p

pour info, en courant continu, P=U.I, et quand on parle d'énergie en élec on parle de décharge complète en un temps donné, donc 10 000 mAh te donne une batterie d'une capacité total de 10A , donc si P=U.i, P=5(V)x10(A)=50(W)

donc pour calculé la capacité total de ses batterie a décharge lente, tu utilise un chargeur donc tu connais les spécificité, et tu chronomètre de 0% a 100%, et tu fait :-

C(max) = P(max) = U(chargeur) x I(chargeur) x Th( 1 heure) 

(  - Th = Tc (Temps chronométré ) / Nhc (nombre d'heure chronométré) 

    - Nhc = Tc / 3600  )",1,,
MrN4yI2K-5g,merci,0,,
MrN4yI2K-5g,Vidéo fort utile comme d’habitude. Je vais me laisser tenter par celle d’apple pour l’intégration avec Ios. Petite question: la coque de ton 12 pro max est celle en cuir ou en silicone ? J’hésitais à essayer celle en cuir car la silicone s’est vraiment détériorée très vite. (Au prix ça fait un peu mal au cul  ). Merci,1,,
MrN4yI2K-5g,"Apple connait sa batterie. Apple connait sa tech. La batterie sans contact est le meilleur moyen de niqué la batterie de son tel, donc autant faire confiance à Apple directement, surtout que pour avoir eu des produits anker défectueux, c'est absolument pas une marque gage de qualité. 

Apple c'est toujours plus cher, mais ça fonctionne toujours mieux.",1,,
MrN4yI2K-5g,Ca fait mal d'entendre Apple Ouatch quand même,0,,
MrN4yI2K-5g,A quand des coques magsafe pour Android,0,,
MrN4yI2K-5g,Tres bonne video j ai malheureusement acheté celle d apple et je regrette car que des galeres elle decharge mon tel pour se charger elle je la déconnecte je redémarre le tel rien n y fait j ai un 12 mini donc je vais prendre la anker,1,,
MrN4yI2K-5g,"j’ai un adaptateur secteur 25w APPLE, ça fonctionne super bien   et c’est mieux que la truc qui se plit…",1,,
MrN4yI2K-5g,Avec l’iPhone 12 Pro max si j’ai un sauvegarde et des mises à jour a faire est-ce que je peux le utilisé cette batterie extrême magsafe Pendant que je le recharge l’iPhone 12 Pro max?,1,,
MrN4yI2K-5g,une video sur le test des nouveaux écouteur apple buds beats,0,,
MrN4yI2K-5g,Apple scanne toutes vos photos... Pour votre bien. LOL !,0,,
MrN4yI2K-5g,Pour charger un iPhone 11 Pro il faut acheter un petit accessoire en plus pour le magsafe ainsi pour qu’il soit bien aimanté ou il suffit juste de mettre la batterie externe au dos ?,1,,
MrN4yI2K-5g,"charger une batterie, pour en recharger une autre par induction ... pour moi c'est l'absurdité pure. on doit arriver à la fin avec près de 40% de perte énergétique.",1,,
MrN4yI2K-5g,Je prends pas le risque de mettre une batterie à côté de mes couilles,0,,
MrN4yI2K-5g,C'est vraiment de la bricolage,0,,
MrN4yI2K-5g,A qui est destiné les AirPods ?,0,,
MrN4yI2K-5g,"Salut, que ce soit pour les deux batteries externes que tu présentes, est-il dangereux de les faire charger toute une nuit ? (Dans le cas où ça pourrait diminuer leur état)
Merci  ",1,,
MrN4yI2K-5g,"Merci, super intéressant !",0,,
MrN4yI2K-5g,Merci !,0,,
MrN4yI2K-5g,Je suis avec un iPhone SE première génération et je n’ai aucun bug,0,,
MrN4yI2K-5g,Je te rejoins dans ton analyse . La polyvalence et le prix sont plus bénéfique qu'un widget qui va s'afficher sur l'iPhone.,1,,
MrN4yI2K-5g,Super vidéo et super test,0,,
MrN4yI2K-5g,"La anker fonctionne sur un samsung ? 
Le magnétisme n'est pas délétère pour le smartphone ?",1,,
MrN4yI2K-5g,Wow serieux excellente video comme d’habitude ta façon de raisonner est tellement logic et bien expliquer je n’avais même pas pensé acheter la batterie apple car elle a une moin grosse capacité de charge mes en entendant tes explications je me suis dis il a 100% raison se n’est pas une batterie externe s’est une batterie pour stabiliser le pourcentage,1,,
MrN4yI2K-5g,"Merci pour ce test, question: la batterie Apple a t’elle la puce de localisation si on la perd?",1,,
MrN4yI2K-5g,A 49€ j'aurais dit oui. A 109€ non.,1,,
MrN4yI2K-5g,"Je trouve le principe MagSafe top, surtout en ayant bricolé un chargeur qui tient en support dans la voiture mon iPhone. Par contre, à part les coques apple (hors de prix), je n’en trouve pas beaucoup d’autres. Des recommandations ?",1,,
MrN4yI2K-5g,"Hello, j'ai une question. Est ce que la batterie Anker est rechargeable avec le cable inclus donc USB-C vers USB-C ( car dans la vidéo vous dites qu'il faut un USB-C vers USB ) et si oui, peut elle charger indépendamment ou il faut à tout prix que le téléphone soit posé sur la batterie externe pour que la batterie recharge ?",1,,
MrN4yI2K-5g,La batterie des iphone,0,,
MrN4yI2K-5g,"Le prix des accessoire Apple ! L éternel problème. 
Merci pour cette vidéo et très bonne blague de fin ! Le moins drôle c’est que des clients et des collègues y croient.",1,,
MrN4yI2K-5g,Superbe analyse comme toujours. J'ai tout commandé en liens affiliés (sauf batterie Apple) pour aider la chaine au passage.,0,,
MrN4yI2K-5g,"Bonjour, ton comparatif est super, merci.Je vais faire une recherche pour une utilisation sur 5 SE 2ge.",1,,
MrN4yI2K-5g,"Perso, j'ai la batterie samsung sans fil, 10000mah, qui recharge ma montre, mon tel, et mes écouteurs, en fast charge, pour 29euros à boulanger ... pas besoin de plus. très bonne vidéo.",1,,
MrN4yI2K-5g,Je reçois la Anker demain :),0,,
MrN4yI2K-5g,"Ça sert à rien, rien ne remplace le bon petit batterie externe de famille ! En plus les batteries externes de nos jours peuvent être recharge sans fil donc plus besoin d’en mêler les câbles",1,,
w4nUatQpcw4,Installez Raid gratuitement   IOS/ANDROID/PC : https://clcr.me/tTFqIi et recevez un pack de démarrage spécial   Disponible uniquement pour les 30 prochains jours,0,,
w4nUatQpcw4,Et pas Google+?,0,,
w4nUatQpcw4,"""Les dédicasses a 36€, les discussions a 125$"" mdrrrrrr",0,,
w4nUatQpcw4,Moi je dirais que le prochain sera tik tok vu sa hyper grande popularité,0,,
w4nUatQpcw4,Arrêtez de parler de raid c est un ptn de casino,0,,
w4nUatQpcw4,Tik Tok va bientôt se casser la gueule.,0,,
w4nUatQpcw4,#FREEPALESTINE,0,,
w4nUatQpcw4,au moins j'ai de leau,0,,
w4nUatQpcw4,J'ai liker meme si je n'ai pas d'insta,0,,
w4nUatQpcw4,"Je suis la réponse étonnante, je ne vais pas souvent sur les raiseaux sociaux",0,,
w4nUatQpcw4,Perso je déteste les réseaux sociaux le seul que je me sert c'est twitter pour les news des jeux et mon compte Facebook est à l'abandon quand je m'en servais encore ya des années,1,,
w4nUatQpcw4,XPTDRRR il a galérer a appuyer sur le bouton de recompenses dans la sponso,0,,
w4nUatQpcw4,DES V PARTOUT !,0,,
w4nUatQpcw4,Dire que vine est mort j'avais vu sa dans le zap sur d17 à l'époque à la télé dire que c est mort et à été remplacer par tik tok. Je préfère tik tok .  Vine existe encore mais clairement sa a changer,1,,
w4nUatQpcw4,Vine a quand même apporter Shiloh dynasti dans le game de la musique du lofi et du cloud rap us la plupart du temps,1,,
w4nUatQpcw4,Et ARN messenger on en parle?,0,,
w4nUatQpcw4,Facebook mourrera en même temps que les vieux,0,,
w4nUatQpcw4,Snapchat est pas loin de mourir aussi,0,,
w4nUatQpcw4,"Ouah cette voix
J'étais en mode
Attend c'était vraiment une vidéo de leo techmacker ?",0,,
w4nUatQpcw4,En réseau social mort et enterrés t’as oublié périscope qui permettait de faire des diffusions en direct,0,,
w4nUatQpcw4,"Hmmmmmmm
Clubhouse dans la liste",0,,
w4nUatQpcw4,"Non, et je boys cote les réseaux sociaux depuis des années.",0,,
w4nUatQpcw4,T’aurais aussi pus parler de Beme,0,,
w4nUatQpcw4,amino,0,,
w4nUatQpcw4,8:24 la reconstitution est juste magnifique xD,0,,
w4nUatQpcw4,Le prochain peut-être animo mdr,0,,
w4nUatQpcw4,Moi je dit que Facebook va mourir,0,,
w4nUatQpcw4,discord les enterras tous,0,,
w4nUatQpcw4,"Pourquoi on ne parle pas de Tumblr? Depuis le bannissement des comptes et contenus nsfw c'est devenu désertique, on peut même dire qu'il est mort même s'il existe encore. Aussi le prochain réseau qui pourrait mourir ça serait facebook vu son état de plus en plus pitoyable mais ça va sûrement prendre quelques années",1,,
w4nUatQpcw4,fact quel on screen tiktok et qu'on envoie l'image(sur discord par exemple)  bah le nom dedans y'a musicaly voila X),0,,
w4nUatQpcw4,Elle a quoi sa voix,0,,
w4nUatQpcw4,Les vrais se rappelle de miiverse   Alias le pire réseaux social du monde tiktok et twitter est bas niveau à côté,0,,
w4nUatQpcw4,"Bientôt, d'ici 2022, le bouton dislikes ne sera plus mis en valeur comme le dislike des commentaires ! Qu'en pensez vous ?",1,,
w4nUatQpcw4,"Twitter et des achats hasardeux : Vine, Périscope... Tout le monde n'a pas le nez de Mark Zuckerberg",1,,
w4nUatQpcw4,"J’aime bien le logo de Clash, et avec une bonne pub je pense qu’il a une petite chance.",0,,
w4nUatQpcw4,Je ne connaissais que myspace dans le tas xD,0,,
w4nUatQpcw4,Pourquoi y a musical dans la miniature?,0,,
w4nUatQpcw4,J'aurais pu espérer voir Amino mais bon il est pas totalement mort... juste dépasser par les autes x) mais après sa reste un bon réseau accès communauté,0,,
w4nUatQpcw4,C'est moi ou sa voix est bizarre?,0,,
w4nUatQpcw4,Jake Paul... brrrrr,0,,
w4nUatQpcw4,Vine,0,,
w4nUatQpcw4,9:31 minecraft,0,,
w4nUatQpcw4,Une vidéo sur le mii place ? Avec le fait que les mii sont quasi oublier sur switch,1,,
w4nUatQpcw4,"je suis sur que la prochaine video sera sur la disparition des pouces rouges


Edit:J'avais raison",0,,
w4nUatQpcw4,Vraiment bonne vidéo gg,0,,
w4nUatQpcw4,Cette vidéo me fait découvrir que vines 2 a fini par sortir et que y a une 3e vidéo,0,,
w4nUatQpcw4,Refait la vidéo dans 5 ans pour voir les nouveaux réseaux sociaux qui sont morts entre temps,1,,
w4nUatQpcw4,Nufff.. nuifff.nuuuf.niif.mnnu8iffuu.nuuuf...nuuuf.. mnuiiif..,0,,
w4nUatQpcw4,La balle perdu pour Tibo in shape je suis mort,0,,
w4nUatQpcw4,Non je traîne pas sur le réseau sociaux à merd je suis sur YouTube,0,,
w4nUatQpcw4,12:54 tu as fait quoi avec les masques ??,0,,
w4nUatQpcw4,7:11 Bravo vous êtes ! Vous aller voir c'est facile ! Clique sur le bouton rouge !,0,,
w4nUatQpcw4,youtube non tiktok jsp,0,,
w4nUatQpcw4,8:32 mdr je lai veux ces chiottes,0,,
w4nUatQpcw4,8:27 leo l'investisseur,0,,
w4nUatQpcw4,Salut Léo est-ce que tu pourrais faire une vidéo sur comment tu fais ton montage et comment tu fais ta voix off,1,,
w4nUatQpcw4,C quoi twitter lol,0,,
w4nUatQpcw4,la musique nous dérange,0,,
w4nUatQpcw4,Snap,0,,
w4nUatQpcw4,jaie bain vue que se deux percon que baisse se sa,0,,
w4nUatQpcw4,Vine > TIK TOK,0,,
w4nUatQpcw4,Musical.ly est juste devenu TikTok en fait,0,,
w4nUatQpcw4,Bas vine sa me rappelle tik tok,0,,
w4nUatQpcw4,Encore une excellente vidéo !! Bon par contre j'ai ralenti la vidéo parce que j'ai trouvé le débit de parole un peu rapide. Mais bon c'est pas si grave. Bonne journée !,1,,
w4nUatQpcw4,J'adore sa voix ._.,0,,
Yqt-1FKxBMU,"Vous êtes tous là à vous la péter avec vos first, mais moi j'ai le commentaire épinglé, ET TOC",0,,
Yqt-1FKxBMU,ᵃ,0,,
